{
    "maxVersionMajor": 1,
    "maxVersionMinor": 16,
    "maxVersionPatch": 0,
    "maxVersionRevision": 14,
    "renamedIds": {
        "minecraft:lodestone_block": "minecraft:lodestone",
        "minecraft:twisting_vines_block": "minecraft:twisting_vines"
    },
    "addedProperties2": {
        "facing_direction": {
            "minecraft:melon_stem": {
                "int": 0
            },
            "minecraft:pumpkin_stem": {
                "int": 0
            }
        }
    },
    "removedProperties2": {
        "wall_block_type": [
            "minecraft:blackstone_wall",
            "minecraft:polished_blackstone_brick_wall",
            "minecraft:polished_blackstone_wall"
        ]
    },
    "remappedPropertyValues2": {
        "wall_block_type": {
            "minecraft:cobblestone_wall": "wall_block_type_00"
        }
    },
    "remappedPropertyValuesIndex": {
        "wall_block_type_00": [
            {
                "old": {
                    "string": "blackstone"
                },
                "new": {
                    "string": "cobblestone"
                }
            },
            {
                "old": {
                    "string": "polished_blackstone"
                },
                "new": {
                    "string": "cobblestone"
                }
            },
            {
                "old": {
                    "string": "polished_blackstone_brick"
                },
                "new": {
                    "string": "cobblestone"
                }
            }
        ]
    }
}
