{
    "maxVersionMajor": 1,
    "maxVersionMinor": 20,
    "maxVersionPatch": 40,
    "maxVersionRevision": 3,
    "renamedProperties2": {
        "facing_direction": {
            "minecraft:chest": "minecraft:cardinal_direction",
            "minecraft:ender_chest": "minecraft:cardinal_direction",
            "minecraft:stonecutter_block": "minecraft:cardinal_direction",
            "minecraft:trapped_chest": "minecraft:cardinal_direction"
        }
    },
    "remappedPropertyValues2": {
        "facing_direction": {
            "minecraft:chest": "facing_direction_00",
            "minecraft:ender_chest": "facing_direction_00",
            "minecraft:stonecutter_block": "facing_direction_00",
            "minecraft:trapped_chest": "facing_direction_00"
        }
    },
    "remappedPropertyValuesIndex": {
        "facing_direction_00": [
            {
                "old": {
                    "int": 0
                },
                "new": {
                    "string": "north"
                }
            },
            {
                "old": {
                    "int": 1
                },
                "new": {
                    "string": "north"
                }
            },
            {
                "old": {
                    "int": 2
                },
                "new": {
                    "string": "north"
                }
            },
            {
                "old": {
                    "int": 3
                },
                "new": {
                    "string": "south"
                }
            },
            {
                "old": {
                    "int": 4
                },
                "new": {
                    "string": "west"
                }
            },
            {
                "old": {
                    "int": 5
                },
                "new": {
                    "string": "east"
                }
            }
        ]
    }
}
