{
    "maxVersionMajor": 1,
    "maxVersionMinor": 16,
    "maxVersionPatch": 210,
    "maxVersionRevision": 3,
    "addedProperties2": {
        "item_frame_photo_bit": {
            "minecraft:frame": {
                "byte": 0
            },
            "minecraft:glow_frame": {
                "byte": 0
            }
        }
    }
}
