{
    "maxVersionMajor": 1,
    "maxVersionMinor": 16,
    "maxVersionPatch": 0,
    "maxVersionRevision": 16,
    "addedProperties2": {
        "pillar_axis": {
            "minecraft:chain": {
                "string": "y"
            }
        }
    },
    "renamedProperties2": {
        "facing_direction": {
            "minecraft:bee_nest": "direction",
            "minecraft:beehive": "direction"
        }
    },
    "remappedPropertyValues2": {
        "facing_direction": {
            "minecraft:bee_nest": "facing_direction_00",
            "minecraft:beehive": "facing_direction_00"
        }
    },
    "remappedPropertyValuesIndex": {
        "facing_direction_00": [
            {
                "old": {
                    "int": 1
                },
                "new": {
                    "int": 0
                }
            },
            {
                "old": {
                    "int": 3
                },
                "new": {
                    "int": 0
                }
            },
            {
                "old": {
                    "int": 4
                },
                "new": {
                    "int": 1
                }
            },
            {
                "old": {
                    "int": 5
                },
                "new": {
                    "int": 3
                }
            }
        ]
    }
}
