{
    "maxVersionMajor": 1,
    "maxVersionMinor": 16,
    "maxVersionPatch": 0,
    "maxVersionRevision": 0,
    "addedProperties2": {
        "rotation": {
            "minecraft:jigsaw": {
                "int": 0
            }
        },
        "wall_connection_type_east": {
            "minecraft:cobblestone_wall": {
                "string": "none"
            }
        },
        "wall_connection_type_north": {
            "minecraft:cobblestone_wall": {
                "string": "none"
            }
        },
        "wall_connection_type_south": {
            "minecraft:cobblestone_wall": {
                "string": "none"
            }
        },
        "wall_connection_type_west": {
            "minecraft:cobblestone_wall": {
                "string": "none"
            }
        },
        "wall_post_bit": {
            "minecraft:cobblestone_wall": {
                "byte": 0
            }
        }
    }
}
