{
    "maxVersionMajor": 1,
    "maxVersionMinor": 16,
    "maxVersionPatch": 210,
    "maxVersionRevision": 3,
    "removedProperties2": {
        "deprecated": [
            "minecraft:stripped_crimson_hyphae",
            "minecraft:stripped_crimson_stem",
            "minecraft:stripped_warped_hyphae",
            "minecraft:stripped_warped_stem"
        ]
    }
}
