{
    "maxVersionMajor": 1,
    "maxVersionMinor": 12,
    "maxVersionPatch": 0,
    "maxVersionRevision": 1,
    "addedProperties2": {
        "direction": {
            "minecraft:campfire": {
                "int": 0
            }
        },
        "extinguished": {
            "minecraft:campfire": {
                "byte": 0
            }
        },
        "open_bit": {
            "minecraft:barrel": {
                "byte": 0
            }
        },
        "powered_bit": {
            "minecraft:lectern": {
                "byte": 0
            }
        },
        "toggle_bit": {
            "minecraft:bell": {
                "byte": 0
            }
        }
    },
    "renamedProperties2": {
        "direction": {
            "minecraft:blast_furnace": "facing_direction",
            "minecraft:coral_fan": "coral_fan_direction",
            "minecraft:coral_fan_dead": "coral_fan_direction",
            "minecraft:smoker": "facing_direction"
        },
        "fill_level": {
            "minecraft:composter": "composter_fill_level"
        }
    },
    "remappedPropertyValues2": {
        "direction": {
            "minecraft:blast_furnace": "direction_00",
            "minecraft:smoker": "direction_00"
        },
        "facing_direction": {
            "minecraft:barrel": "facing_direction_00"
        }
    },
    "remappedPropertyValuesIndex": {
        "direction_00": [
            {
                "old": {
                    "int": 0
                },
                "new": {
                    "int": 3
                }
            },
            {
                "old": {
                    "int": 1
                },
                "new": {
                    "int": 4
                }
            },
            {
                "old": {
                    "int": 3
                },
                "new": {
                    "int": 5
                }
            }
        ],
        "facing_direction_00": [
            {
                "old": {
                    "int": 6
                },
                "new": {
                    "int": 0
                }
            },
            {
                "old": {
                    "int": 7
                },
                "new": {
                    "int": 0
                }
            }
        ]
    }
}
