{
    "maxVersionMajor": 1,
    "maxVersionMinor": 18,
    "maxVersionPatch": 10,
    "maxVersionRevision": 1,
    "renamedIds": {
        "minecraft:frog_egg": "minecraft:frog_spawn"
    },
    "addedProperties2": {
        "pillar_axis": {
            "minecraft:ochre_froglight": {
                "string": "y"
            },
            "minecraft:pearlescent_froglight": {
                "string": "y"
            },
            "minecraft:verdant_froglight": {
                "string": "y"
            }
        }
    }
}
